"title","journal","year","otros_investigadores"
"Generalized perfect spaces","Indagationes Mathematicae",2008,"JM Calabuig;O Delgado;EAS Pérez"
"Dreaming machine learning: Lipschitz extensions for reinforcement learning on financial markets","Neurocomputing",2020,"JM Calabuig;H Falciani;EA Sánchez-Pérez"
"Factorizing operators on Banach function spaces through spaces of multiplication operators","Journal of mathematical analysis and applications",2010,"JM Calabuig;O Delgado;EAS Pérez"
"On the Banach lattice structure of of a vector measure on a-ring","Collectanea Mathematica",2014,"JM Calabuig;O Delgado;MA Juan;EA Sánchez Pérez"
"Aprender como una máquina: introduciendo la Inteligencia Artificial en la enseñanza secundaria","Modelling in Science Education and Learning",2021,"JM Calabuig Rodriguez;LM García Raffi;EA Sánchez Pérez"
"Trabajar con datos abiertos en tiempos de pandemia: uso de covidDATA-19","El profesional de la información",2020,"SD Toro;M Isabel;JM Calabuig;A Ferrer Sapena;MF Peset Mancebo"
"Kaplan-Meier type survival curves for Covid-19: a health data based decision-making tool","Frontiers in public health",2021,"JM Calabuig;LM García-Raffi;A García-Valiente;EA Sánchez-Pérez"
"Compactness in L1 of a vector measure","Studia Mathematica",2014,"JM Calabuig Rodriguez;S Lajara;J Rodríguez Ruiz;EA Sánchez Pérez"
"On the Structure of L1 of a Vector Measure via its Integration Operator","Integral Equations and Operator Theory",2009,"JM Calabuig;J Rodríguez;EA Sánchez-Pérez"
"Radon–Nikodým derivatives for vector measures belonging to Köthe function spaces","Journal of mathematical analysis and applications",2008,"JM Calabuig;P Gregori;EAS Pérez"
"Gobierno abierto y acceso a la información: un estudio de caso sobre el impacto en la economía local","BiD: textos universitaris de biblioteconomia i documentació",2020,"A Ferrer Sapena;JM Calabuig;EA Sánchez Pérez;C Vidal-Cabo"
"Spaces of p-integrable functions with respect to a vector measure defined on a delta-ring","Operators and Matrices",2012,"JM Calabuig Rodriguez;MA Juan Blanco;EA Sánchez Pérez"
"Convolution-continuous bilinear operators acting on Hilbert spaces of integrable functions","",2018,"E Erdoğan;JM Calabuig;EA Sanchez Perez"
"Fourier Transform and Convolutions on L               p                of a Vector Measure on a Compact Hausdorff Abelian Group","Journal of Fourier Analysis and Applications",2013,"JM Calabuig;F Galaz-Fontes;EM Navarrete;EA Sánchez-Pérez"
"A bilinear version of Orlicz–Pettis theorem","Journal of mathematical analysis and applications",2008,"O Blasco;JM Calabuig;T Signes"
"On p-Dunford integrable functions with values in Banach spaces","Journal of Mathematical Analysis and Applications",2018,"JM Calabuig;J Rodríguez;P Rueda;EA Sánchez-Pérez"
"Multiplication operators in Köthe–Bochner spaces","Journal of mathematical analysis and applications",2011,"JM Calabuig;J Rodriguez;EA Sánchez-Pérez"
"Weak continuity of Riemann integrable functions in Lebesgue-Bochner spaces","Acta Mathematica Sinica, English Series",2010,"JM Calabuig;J Rodriguez;EA Sanchez-Perez"
"On completely continuous integration operators of a vector measure","J. Convex Anal",2014,"JM Calabuig;J Rodríguez;EA Sánchez-Pérez"
"Finite semivariation and regulated functions by means of bilinear maps","",2000,"O Blasco"
"La modelización como competencia transversal en el sistema educativo español","UNO. Revista de didáctica de las matemáticas",2015,"JM Calabuig;I Ferrando Palomares;C Gallart-Palau;LM García-Raffi;..."
"Strongly embedded subspaces of p-convex Banach function spaces","Positivity",2013,"JM Calabuig;J Rodríguez;EA Sánchez-Pérez"
"Álgebra lineal y juegos de mesa","Modelling in Science Education and Learning",2013,"JM Calabuig;LM Garcia-Raffi;EA Sánchez-Pérez"
"Fourier analysis with respect to bilinear maps","Acta Mathematica Sinica, English Series",2009,"O Blasco;JM Calabuig"
"Strong factorization of operators on spaces of vector measure integrable functions and unconditional convergence of series","Mathematische Zeitschrift",2007,"JM Calabuig;F Galaz-Fontes;E Jiménez-Fernández;EA Sánchez Pérez"
"Summability in of a vector measure","Mathematische Nachrichten",2017,"JM Calabuig;J Rodríguez;EA Sánchez‐Pérez"
"Extending and factorizing bounded bilinear maps defined on order continuous Banach function spaces","Revista de la Real Academia de Ciencias Exactas, Fisicas y Naturales. Serie …",2014,"JM Calabuig;M Fernandez Unzueta;F Galaz-Fontes;EA Sánchez-Pérez"
"Interpolation subspaces of L^ 1 of a vector measure and norminequalities for the integration operator","Contemporary Mathematics",2012,"JM Calabuig Rodriguez;J Rodríguez Ruiz;EA Sánchez Pérez"
"Vector-valued functions integrable with respect to bilinear maps","Taiwanese Journal of Mathematics",2008,"O Blasco;JM Calabuig"
"Extension procedures for lattice Lipschitz operators on Euclidean spaces","Revista de la Real Academia de Ciencias Exactas, Físicas y Naturales. Serie …",2023,"R Arnau;JM Calabuig;E Erdoğan;EA Sánchez Pérez"
"Modeling hospital resource management during the covid-19 pandemic: An experimental validation","Econometrics",2021,"JM Calabuig;E Jiménez-Fernández;EA Sánchez-Pérez;S Manzanares"
"Maximal factorization of operators acting in Köthe–Bochner spaces","The Journal of Geometric Analysis",2021,"JM Calabuig;M Fernández-Unzueta;F Galaz-Fontes;EA Sánchez-Pérez"
"Representation and factorization theorems for almost-Lp-spaces","Indagationes Mathematicae",2019,"JM Calabuig;OG Bravo;MA Juan;EAS Pérez"
"Optimal extensions of compactness properties for operators on Banach function spaces","Topology and its Applications",2016,"JM Calabuig;EJ Fernández;MA Juan;EAS Pérez"
"Álgebra lineal y descomposición en valores singulares","Modelling in Science Education and Learning",2015,"JM Calabuig;LM Garcia Raffi;EA Sánchez-Perez"
"Hölder inequality for functions that are integrable with respect to bilinear maps","Mathematica scandinavica",2008,"O Blasco;JM Calabuig"
"Tensor product representation of Köthe-Bochner spaces and their dual spaces","Positivity",2016,"JM Calabuig;E Jiménez Fernández;MA Juan;EA Sánchez Pérez"
"The weak topology on q‐convex Banach function spaces","Mathematische Nachrichten",2012,"L Agud;JM Calabuig;EA Sánchez Pérez"
"Using neural networks and hierarchical cluster analysis to study goal kicks in football","International Journal of Sports Science & Coaching",2024,"AR Arnau Notari;JM Calabuig;C Catalan;LM Garcia Raffi;JM Pardo Gila;..."
"Graph distances for determining entities relationships: a topological approach to fraud detection","International Journal of Information Technology & Decision Making",2023,"JM Calabuig;H Falciani;AF Sapena;LMG Raffi;EAS Pérez"
"Absolutely (q, 1)-summing operators acting in C(K)-spaces and the weighted Orlicz property for Banach spaces","Positivity",2021,"JM Calabuig;EA Sánchez Pérez"
"Weighted -regular kernels for reproducing kernel Hilbert spaces and Mercer Theorem","Analysis and Applications",2020,"L Agud;JM Calabuig;EA Sánchez Pérez"
"Equivalent norms in a Banach function space and the subsequence property","arXiv preprint arXiv:",2018,"JM Calabuig;MF Unzueta;F Galaz-Fontes;EAS Pérez"
"Detección y prevención de las malas prácticas y la corrupción desde la perspectiva de las matemáticas","Revista internacional de transparencia e integridad",2018,"JM Calabuig;H Falciani;A Ferrer Sapena;LM García-Raffi;E Raso;..."
"Differentiability of  of a vector measure and applications to the Bishop–Phelps–Bollobás property","Revista de la Real Academia de Ciencias Exactas, Físicas y Naturales. Serie …",2017,"L Agud;JM Calabuig;S Lajara;EA Sánchez-Pérez"
"Vector-valued impact measures and generation of specific indexes for research assessment","Scientometrics",2016,"JM Calabuig;A Ferrer-Sapena;EA Sánchez-Pérez"
"Lattice Lipschitz superposition operators on Banach function spaces","Journal of Mathematical Analysis and Applications",2025,"R Arnau;JM Calabuig;E Erdoğan;EAS Pérez"
"A Bellman–Ford Algorithm for the Path-Length-Weighted Distance in Graphs","Mathematics",2024,"R Arnau;JM Calabuig;LM García-Raffi;EA Sánchez Pérez;S Sanjuan"
"Approximation of almost diagonal non-linear maps by lattice Lipschitz operators","Bulletin of the Brazilian Mathematical Society, New Series",2024,"R Arnau;JM Calabuig;E Erdoğan;EA Sánchez Pérez"
"Measure-Based Extension of Continuous Functions and p-Average-Slope-Minimizing Regression","Axioms",2023,"R Arnau;JM Calabuig;EA Sánchez Pérez"
"Representation of Lipschitz Maps and Metric Coordinate Systems","Mathematics",2022,"R Arnau;JM Calabuig;EA Sánchez Pérez"
"Govern obert i accés a la informació: un estudi de cas sobre l'impacte en l'economia local","BiD",2020,"A Ferrer-Sapena;JM Calabuig;EAS Pérez;C Vidal-Cabo"
"Evolution model for epidemic diseases based on the Kaplan-Meier curve determination","Mathematics",2020,"JM Calabuig;LM García-Raffi;A García-Valiente;EA Sánchez-Pérez"
"Banach lattice structures and concavifications in banach spaces","Mathematics",2020,"L Agud;JM Calabuig;MA Juan;EA Sanchez Perez"
"Trabajar con datos abiertos en tiempos de pandemia: uso de covidDATA-19","El profesional de la información",2020,"AF Sapena;JMC Rodríguez;MFP Mancebo;IS del Toro"
"-variations of vector measures with respect to vector measures and integral representation of operators","Banach Journal of Mathematical Analysis",2015,"O Blasco;JM Calabuig;EA Sánchez-Pérez"
"p-variation of vector measures with respect to bilinear maps","Bulletin of the Australian Mathematical Society",2008,"O Blasco;JM Calabuig"
"GRAPH DISTANCES FOR DETERMINING INTER-ENTITIES RELATIONS: A TOPOLOGICAL APPROACH TO FRAUD DETECTION (WORK IN PROGRESS)","",NA,"JM Calabuig;H Falciani;A Ferrer-Sapena;LM Garcia-Raffi;..."
"Metric symmetry and distance distribution functions on graphs","Aequationes mathematicae",2025,"JM Calabuig;EA Sánchez Pérez;S Sanjuan"
"Mathematical Modeling and Machine Learning for Predicting Shade-Seeking Behavior in Cows Under Heat Stress","arXiv preprint arXiv:",2025,"S Sanjuan;DA Méndez;R Arnau;JM Calabuig;X Aguirre;F Estellés"
"A Mathematical Model to Study Defensive Metrics in Football: Individual, Collective and Game Pressures","Mathematics",2024,"JM Calabuig;C Catalán;LM García-Raffi;EA Sánchez-Pérez"
"Lattice Lipschitz operators on space","arXiv preprint arXiv:",2024,"R Arnau;JM Calabuig;EA Sánchez-Pérez"
"Guía práctica¿ Cómo abrir los algoritmos públicos?","Universitat de València",2024,"JM Calabuig"
"Guía práctica¿ Cómo abrir los algoritmos públicos?. Recomendaciones para la implantación de registros de algoritmos públicos","Universitat Politècnica de València-Universitat de València",2024,"JM Calabuig Rodriguez;L Cotino Hueso;A Ferrer-Sapena;..."
"Moduli of Continuity in Metric Models and Extension of Livability Indices","Axioms",2024,"R Arnau;JM Calabuig;Á González;EA Sánchez Pérez"
"Enseñanza del aprendizaje por refuerzo con un sencillo ejemplo de minimización de funciones","Editorial Universitat Politècnica de València",2023,"AR Arnau Notari;LM García Raffi;JM Calabuig Rodriguez;..."
"Extension procedures for lattice Lipschitz operators on Euclidean spaces","Revista de la Real Academia de Ciencias Exactas Físicas y Naturales Serie A …",2023,"AR Arnau-Notari;JM Calabuig;E Erdogan;EA Sánchez Pérez"
"Neural networks as universal approximators","Selected aspects of complex, hypercomplex and fuzzy neural networks",2023,"JM Calabuig;LM Garcıa-Raffi"
"Selected aspects of complex, hypercomplex and fuzzy neural networks","arXiv preprint arXiv:",2022,"A Niemczynowicz;RA Kycia;M Jaworski;A Siemaszko;JM Calabuig;..."
"Modeling Hospital Resource Management during the COVID-19 Pandemic: An Experimental Validation","MDPI",2021,"JM Calabuig Rodríguez;E Jiménez Fernández;EA Sánchez Pérez;..."
"Where should I submit my work for publication? An asymmetrical classification model to optimize choice","Journal of Classification",2020,"A Ferrer-Sapena;JM Calabuig;LM García Raffi;EA Sánchez Pérez"
"Govern obert i accés a la informació: un estudi de cas sobre l'impacte en l'economia local","BiD: Textos universitaris de biblioteconomia i documentació",2020,"AF Sapena;JMC Rodríguez;EAS Pérez;CV Cabo"
"Completability and optimal factorization norms in tensor products of Banach function spaces","Revista de la Real Academia de Ciencias Exactas, Físicas y Naturales. Serie …",2019,"JM Calabuig;M Fernández-Unzueta;F Galaz-Fontes;EA Sánchez-Pérez"
"Document downloaded from","",2018,"JM Calabuig;M Fernández-Unzueta;F Galaz-Fontes;EA Sánchez Pérez"
"Hacia nuevos modelos de comunicación científica. Sciechain: propuesta para la revalorización del trabajo científico basada en tecnología blockchain","",2018,"JS Bejarano-Ballen;F Peset;JM Calabuig;A Ferrer-Sapena;..."
"QUASI-PSEUDO-METRICS AND EXTENSION OF LIPSCHITZ-TYPE FUNCTIONS IN MACHINE LEARNING (WORK IN PROGRESS)","",2018,"JM CALABUIG;H FALCIANI;EA SÁNCHEZ-PÉREZ"
"DREAMING MACHINE LEARNING: QUASI-DISTANCES AND LIPSCHITZ EXTENSIONS FOR MODELING FINANCIAL PROCESSES (WORK IN PROGRESS)","",2018,"JM CALABUIG;H FALCIANI;EA SÁNCHEZ-PÉREZ"
"GRAPH QUASI-DISTANCES AND EXTENSION OF SEMI-LIPSCHITZ FUNCTIONS IN MACHINE LEARNING (WORK IN PROGRESS)","",2018,"JM CALABUIG;H FALCIANI;LM GARCÍA-RAFFI;EA SÁNCHEZ-PÉREZ"
"Visualizando la transformación económica: fuentes de información abiertas para indicadores económicos","Anuario ThinkEPI",2018,"JM Calabuig;MF Peset Mancebo"
"FACTORIZATION OF OPERATORS THROUGH SUBSPACES OF-SPACES","Journal of the Australian Mathematical Society",2017,"JM Calabuig;J Rodríguez;EA SÁNCHEZ-PÉREZ"
"Contemporary Mathematics Volume 561, 2012","Topics in Complex Analysis and Operator Theory: Third Winter School in …",2012,"JM Calabuig;J Rodríguez;EA Sánchez-Pérez"
"Topics in Complex Analysis and Operator Theory: Third Winter School in Complex Analysis and Operator Theory, February 2-5, 2010, Universidad Politécnica de Valencia, Valencia …","American Mathematical Soc.",2012,"O Blasco"
"Optimal Domain Theorem and Bounded Bilinear Maps","Integration, Vector Measures and Related Topics IV",2011,"JM Calabuig"
"Fourier Analysis for L^ p of a vector measure","Functional Analysis Valencia",2010,"JM Calabuig"
"EXTENSION PROCEDURES FOR LATTICE LIPSCHITZ MAPPINGS","",NA,"R ARNAU;JM CALABUIG;E ERDOGAN;EAS PÉREZ"
"GOBIERNO ABIERTO Y ACCESO A LA INFORMACIóN: UN ESTUDIO DE CASO SOBRE EL IMPACTO EN LA ECONOMíA LOCAL","BID",NA,"PEA SÁNCHEZ;C VIDAL-CABO;A FERRER-SAPENA;JM CALABUIG"
"NUEVOS FOROS EDUCATIVOS PARA LA DOCENCIA DEL SIGLO XXI: MODELLING IN SCIENCE EDUCATION AND LEARNING","",NA,"LM GARCÍA-RAFFI;JM CALABUIG;I FERRANDO;E FUSTER;..."
"Surenet: A Distributed Compliance Network for Taboow","",NA,"JL de la Rosa;H Falciani;JM Calabuig;LMG Raffi;EAS Pérez"
"MSEL","",NA,"JM Calabuig;LMG Raffi;EA Sánchez-Pérez"
"Suavidad de los espacios Lp de una medida vectorial","",NA,"JM Calabuig"
"Holder inequality for functions integrable with respect to bilinear maps","",NA,"JM CALABUIG;O Blasco"
"RADON-NIKODYM DERIVATIVES FOR VECTOR MEASURES BELONGING TO BANACH FUNCTION SPACES","",NA,"JM Calabuig"
"Fourier analysis with respect to bilinear maps.(English) Zbl 1173.42316","",NA,"O Blasco;JM Calabuig"
"p-variation and p-semivariation on Lp of a vector measure","",NA,"O Blasco;JM Calabuig;EAS Pérez"
"Lattice structure of L1 w (ν) and Representation Theorems of Banach Lattices","",NA,"JM Calabuig;O Delgado;MA Juan;EAS Pérez"
