"title","journal","year","otros_investigadores"
"Composition operators between weighted inductive limits of spaces of holomorphic functions","Publ. Math. Debrecen",2005,"J Bonet;M Friz;E Jordá"
"Mean ergodic composition operators on Banach spaces of holomorphic functions","Journal of Functional Analysis",2016,"MJ Beltrán-Meneu;MC Gómez-Collado;E Jordá;D Jornet"
"Optimal regularity at the free boundary for the infinity obstacle problem","Interfaces and Free Boundaries",2015,"JD Rossi;EV Teixeira;JM Urbano"
"Extension of vector-valued holomorphic and harmonic functions","Studia Math",2007,"J Bonet;L Frerick;E Jordá"
"An optimal transportation problem with a cost given by the Euclidean distance plus import/export taxes on the boundary","Revista Matemática Iberoamericana",2014,"JM Mazón;JD Rossi;J Toledo"
"Mean ergodicity of weighted composition operators on spaces of holomorphic functions","Journal of Mathematical Analysis and Applications",2016,"MJ Beltrán-Meneu;MC Gómez-Collado;E Jordá;D Jornet"
"Extension of bounded vector‐valued functions","Mathematische Nachrichten",2009,"L Frerick;E Jordá;J Wengenroth"
"Vector-valued meromorphic functions","Archiv der Mathematik",2002,"J Bonet;E Jordá;M Maestre"
"Tingley's problem for -Schatten von Neumann classes","Journal of Spectral Theory",2020,"FJ Fernández-Polo;E Jordá;AM Peralta"
"Ergodic properties of composition operators on Banach spaces of analytic functions","Journal of Mathematical Analysis and Applications",2020,"E Jordá;A Rodríguez-Arenas"
"Dynamics and spectra of composition operators on the Schwartz space","Journal of Functional Analysis",2018,"C Fernández;A Galbis;E Jordá"
"Weighted Vector‐Valued Holomorphic Functions on Banach Spaces","Abstract and Applied Analysis",2013,"E Jordá"
"Composition operators on the Schwartz space","Revista matemática iberoamericana",2018,"A Galbis;E Jordá"
"Strongly continuous semigroups on some Fréchet spaces","Journal of Mathematical Analysis and Applications",2014,"L Frerick;E Jordá;T Kalmes;J Wengenroth"
"Mean ergodic multiplication operators on weighted spaces of continuous functions","Mediterranean Journal of Mathematics",2018,"J Bonet;E Jordá;A Rodriguez"
"Tame linear extension operators for smooth Whitney functions","Journal of Functional Analysis",2011,"L Frerick;E Jordá;J Wengenroth"
"Extension of vector-valued holomorphic and meromorphic functions","Bulletin of the Belgian Mathematical Society-Simon Stevin",2005,"E Jordá"
"Extension of vector-valued functions","Bulletin of the Belgian Mathematical Society-Simon Stevin",2007,"L Frerick;E Jordá"
"The division problem for tempered distributions of one variable","Journal of Functional Analysis",2012,"J Bonet;L Frerick;E Jordá"
"Whitney extension operators without loss of derivatives","Revista Matemática Iberoamericana",2016,"L Frerick;E Jorda Mora;J Wengenroth"
"Supercyclicity of weighted composition operators on spaces of continuous functions","Collectanea mathematica",2020,"MJ Beltrán-Meneu;E Jordá;M Murillo-Arcila"
"Stability of derivations under weak-2-local continuous perturbations","Aequationes mathematicae",2017,"E Jordá;AM Peralta"
"Power bounded composition operators on spaces of meromorphic functions","Topology and its Applications",2016,"MC Gómez-Collado;E Jordá;D Jornet"
"Dynamics of composition operators on function spaces defined by local and global properties","Journal of Mathematical Analysis and Applications",2022,"AA Albanese;E Jordá;C Mele"
"Dynamics of weighted composition operators on spaces of entire functions of exponential and infraexponential type","Mediterranean Journal of Mathematics",2021,"MJ Beltrán-Meneu;E Jordá"
"Vitali's and Harnack's type results for vector-valued functions","Journal of mathematical analysis and applications",2007,"E Jordá"
"Spectrum of composition operators on S (R) with polynomial symbols","Advances in Mathematics",2020,"C Fernández;A Galbis;E Jordá"
"Ergodic properties of convolution operators","arXiv preprint arXiv:",2020,"J Galindo;E Jordá"
"Existence, uniqueness and decay rates for evolution equations on trees","Portugaliae Mathematica",2014,"LM Del Pezzo;CA Mosquera;E Jordá"
"Isomorphisms on Weighed Banach Spaces of Harmonic and Holomorphic Functions","Journal of Function Spaces",2013,"E Jordá;AM Zarco"
"Inner Derivations and Weak-2-Local Derivations on the C^* C∗-Algebra C_0 (L, A) C 0 (L, A)","Integral Equations and Operator Theory",2017,"E Jordá;AM Peralta"
"Weighted Banach spaces of harmonic functions","Revista de la Real Academia de Ciencias Exactas, Fisicas y Naturales. Serie …",2014,"E Jordá;AM Zarco"
"Topologies on spaces of vector-valued meromorphic functions","Journal of the Australian Mathematical Society",2005,"E Jordá"
"Tingley’s problem for p-Schatten von Neumann classes for 2< p<∞, preprint 2018","arXiv preprint arXiv:",NA,"FJ Fernández-Polo;E Jordá;AM Peralta"
"Nuclear weighted composition operators on weighted Banach spaces of analytic functions","Proceedings of the American Mathematical Society",2021,"J Bonet;M Gómez-Collado;E Jordá;D Jornet"
"Regularity of solutions of convolution equations","Journal of mathematical analysis and applications",2008,"MC Gómez-Collado;E Jordá"
"Generalized Hilbert operators acting on weighted spaces of holomorphic functions with sup-norms","Banach Journal of Mathematical Analysis",2025,"MJ Beltrán-Meneu;J Bonet;E Jordá"
"A characterization of the Schur property through the disk algebra","Journal of Mathematical Analysis and Applications",2017,"D García;E Jordá;M Maestre"
"Cesàro operators associated with Borel measures acting on weighted spaces of holomorphic functions with sup-norms","Analysis and Mathematical Physics",2024,"MJ Beltrán-Meneu;J Bonet;E Jordá"
"Uniformly ergodic probability measures","Publicacions Matemàtiques",2024,"J Galindo;E Jordá;A Rodríguez-Arenas"
"Extension operators for smooth functions on compact subsets of the reals","Mathematische Zeitschrift",2020,"L Frerick;E Jordá;J Wengenroth"
"Power boundedness and related properties for weighted composition operators on S (Rd)","Journal of Functional Analysis",2025,"V Asensio;E Jordá;T Kalmes"
"Positive definite functions as uniformly ergodic multipliers of the Fourier algebra","arXiv preprint arXiv:",2024,"J Galindo;E Jordá;A Rodríguez-Arenas"
"Ces\aro operators associated with Borel measures acting on weighted spaces of holomorphic functions with sup-norm","arXiv preprint arXiv:",2024,"MJB Meneu;J Bonet;E Jordá"
"Cesàro operators associated with Borel measures acting on weighted spaces of holomorphic functions with sup-norm","arXiv e-prints, arXiv:",2024,"M José Beltrán Meneu;J Bonet;E Jordá"
"On the spectrum of isomorphisms defined on the space of smooth functions which are flat at 0","Revista de la Real Academia de Ciencias Exactas, Físicas y Naturales. Serie …",2023,"E Jordá"
"Whitney extension operators with arbitrary loss of differentiability","Journal of Mathematical Analysis and Applications",2020,"L Frerick;A Jakobs;E Jordá;J Wengenroth"
"Dynamics of weighted composition operators on spaces of continuous functions","arXiv preprint arXiv:",2019,"MJ Beltrán;E Jordá;M Murillo-Arcila"
"Dynamics of weighted composition operators on spaces of continuous functions","arXiv e-prints, arXiv:",2019,"M José Beltrán;E Jordá;M Murillo-Arcila"
"Dynamics of weighted composition operators on spaces of continuous functions","",2019,"MJ Beltrán-Meneu;E Jordá;M Murillo-Arcila"
"Infinite Dimensional","",2018,"R Aron;J Bonet;CG Collado;D Jornet;M Maestre;M Acosta;O Blasco;..."
"Mean Ergodic Composition Operators on Banach spaces of holomorphic functions","arXiv e-prints, arXiv:",2016,"M José Beltrán;MC Gómez;E Jordá;D Jornet"
"División de distribuciones atemperadas de una variable","",2013,"E Jordá"
"Mean ergodic composition operators on spaces of holomorphic functions","",NA,"DS Ferra"
"WFCA 2022","",NA,"E Jordá;MJB Menéu;M Murillo-Arcila"
"Operadores de composición entre lımites inductivos de espacios ponderados de funciones holomorfas","Universidad Politécnica de Valencia",NA,"E Jordá"
