"title","journal","year","otros_investigadores"
"Sound diffusing metasurfaces based on elastic plates and membranes","",NA,"JM Requena-Plens;JP Groby;V Romero-García;N Jiménez"
"Regular Paper Optimal absorption of flexural energy in thin plates by critically coupling a locally resonant grating","",NA,"J Lenga;V Romero-Garcıa;F Gautier;A Pelat;R Picó;JP Groby"
"Natural sonic crystal absorber constituted of Aegagropilae fiber network","",NA,"L Barguet;V Romero-García;N Jiménez;LM Garcia-Raffi;..."
"Closed-forms derivation and experimental validation of the Willis coupling of different asymmetric structures","",NA,"M Malléjac;A Merkel;D Torrent;J Li;V Tournat;V Romero-Garcıa;..."
"Curriculum Vitae Vicente Romero-García","",NA,"V Romero-García"
"BEYOND SCHROEDER DIFFUSERS USING ACOUSTIC METASURFACES","",NA,"N Jiménez;TJ Cox;JM Requena-Plens;E Ballestero;JP Groby;..."
"Perfect and broadband acoustic absorption by metasurfaces made of aerogel clamped plates","",NA,"AAF Marın;V Romero-Garcıa;JP Groby;N Jiménez;F Cervera;..."
"Deep Sub-wavelength Materials for Controlling Sound Diffusion: Experimental Validation of Metadiffusers","",NA,"E Ballestero;N Jiménez;JP Groby;S Dance;V Romero-Garcıa"
"CFA/VISHNO 2016","",NA,"W Huang;JP Groby;VR Garcıa;N Jimenez"
"Perfect Absorption and Total Reflection in Space-Coiled Sub-Wavelength Channels","",NA,"AO Krushynska;V Romero-Garcıa;F Bosia;NM Pugno;JP Groby"
"Supplementary material: Perfect and broadband acoustic absorption by critically coupled sub-wavelength resonators","",NA,"V Romero-Garcıa;G Theocharis;O Richoux;A Merkel;V Tournat;..."
"REFRACTION INDEX BEHAVIOUR OF SONIC CRYSTALS IN THE RANGE OF LOW FREQUENCIES","",NA,"E Fuster-Garcia;V Romero-García;L García Raffi;J Sánchez-Pérez"
"Extraordinary absorption of sound in porous lamella-crystals SUPPLEMENTARY INFORMATION","",NA,"J Christensen;V Romero-Garcıa;R Pico;A Cebrecos;FJG de Abajo;..."
"MSEL","",NA,"LM Garcia-Raffi;V Romero-Garcıa"
"Wave localization in chirped sonic crystals","Book of abstracts. Quodons in Mica",NA,"V Sánchez-Morcillo;LM Garcıa-Raffi;V Romero-Garcıa;R Picó;..."
"Laboratoire d’Acoustique de l’Université du Maine Jounées GdR META, Mardi 7 Juin 2016","",NA,"V Romero-García"
"Nonlinear waves in periodic media: from lattices to superlattices and phononic crystals","",NA,"VJ Sánchez-Morcillo;N Jiménez;A Mehrem;R Picó;LM García-Raffi;..."
"Characterization of the diffraction on the upper edge of acoustic barriers based on sonic crystals. Comparison with the case of classic barriers","",NA,"C Rubio;S Castiñeira-Ibáñez;V Romero-García;JV Sánchez-Pérez"
"Helical Bessel Beam Formation by an Archimedean Spiral Grating","",NA,"N Jiménez;R Picó;LM Garcia-Raffi;V Romero-Garcia;..."
"Diffusion of Sound Waves by Sonic Crystals","",NA,"LJ Salmerón-Contreras;A Cebrecos;N Jiménez;LM García-Raffi;R Picó;..."
"42º CONGRESO ESPAÑOL DE ACÚSTICA ENCUENTRO IBÉRICO DE ACÚSTICA EUROPEAN SYMPOSIUM ON ENVIRONMENTAL ACOUSTICS AND ON BUILDINGS ACOUSTICALLY SUSTAINABLE","",NA,"V Romero-García;R Picó;I Pérez-Arjona;J Redondo;V Espinosa;..."
"Focalizacióndeondasacústicas medianteunalenteformadapor dispersorestoroidalesrígidos.","",NA,"D Tarrazó-Serrano;R Picó;V Romero-García;A Cebrecos;N Jiménez;..."
"OPTIMIZATION OF THE ACOUSTIC ATTENUATION OF SONIC CRYSTALS BY MEANS OF THE CREATION OF VACANCIES","",NA,"E Fuster-Garcia;V Romero-García;L García Raffi;J Sánchez-Pérez"
"On the Numerical Modeling of Elastic Resonant Acoustic Scatterers","",NA,"V Romero-García;A Krynkin;JV Sánchez-Pérez;S Castiñeira-Ibáñez;..."
