title,journal,year
Laser assisted guiding of electric discharges around objects,Science Advances,2015.0
Soliton families and resonant radiation in a micro ring resonator near zero group velocity dispersion,Optics Express,2014.0
Solitons and frequency combs in silica microring resonators: Interplay of the Raman and higher order dispersion effects,Physical Review Applied,2015.0
Superfilamentation in air,Physical Review Letters,2014.0
Tubular filamentation for laser material processing,Scientific Reports,2015.0
Generation of long lived underdense channels using femtosecond filamentation in air,Journal of Physics B: Atomic Molecular and Optical Physics,2015.0
Spaceborne laser filamentation for atmospheric remote sensing,Laser & photonics reviews,2016.0
Filamentation with nonlinear Bessel vortices,Optics Express,2014.0
Continuum generation by dark solitons,Optics Letters,2009.0
Robust ultrashort light bullets in strongly twisted waveguide arrays,Physical Review Letters,2019.0
Supercontinuum optimization for dual soliton based light sources using genetic algorithms in a grid platform,Optics Express,2014.0
Energy deposition dynamics of femtosecond pulses in water,Applied Physics Letters,2014.0
Underwater acoustic wave generation by filamentation of terawatt ultrashort laser pulses,Physical Review Applied,2016.0
Soliton plasmon resonances as Maxwell nonlinear bound states,Optics Letters,2012.0
Polychromatic Cherenkov radiation and supercontinuum in tapered optical fibers,JOSA B,2012.0
Multi peak spectra generation with Cherenkov radiation in a non uniform single mode fiber,Optics Express,2014.0
Emission of dispersive waves from a train of dark solitons in optical fibers,Optics Letters,2016.0
Existence and switching behavior of bright and dark Kerr solitons in whispering gallery mode resonators with zero group velocity dispersion,The European Physical Journal D,2017.0
Effect of input pulse chirp on nonlinear energy deposition and plasma excitation in water,,2014.0
Bound states in the continuum in a two dimensional PT symmetric system,Optics Letters,2018.0
Quartic Kerr cavity combs: bright and dark solitons,Optics Letters,2022.0
Variational theory of soliplasmon resonances,JOSA B,2013.0
Nonlinear switching in arrays of semiconductor on metal photonic wires,Applied Physics Letters,2011.0
Robust three dimensional high order solitons and breathers in driven dissipative systems: a Kerr cavity realization,Physical Review Applied,2023.0
Clusters of cavity solitons bounded by conical radiation,Physical Review Letters,2018.0
Spectral wings of the fiber supercontinuum and the dark bright soliton interaction,Optics Express,2017.0
Grayness dependent emission of dispersive waves from dark solitons in optical fibers,Optics Letters,2018.0
Anomalous effects on radiation detectors and capacitance measurements inside a modified Faraday cage,Nuclear Instruments and Methods in Physics Research Section A: Accelerators,2016.0
Laser beam self symmetrization in air in the multifilamentation regime,Journal of Physics B: Atomic Molecular and Optical Physics,2015.0
Cavity solitons in a microring dimer with gain and loss,Optics Letters,2018.0
Cumulative effects in 100 kHz repetition rate laser induced plasma filaments in air,Advanced Photonics Research,2023.0
Reversible self replication of spatiotemporal Kerr cavity patterns,Physical Review Letters,2021.0
Collision between a dark soliton and a linear wave in an optical fiber,Optics Express,2018.0
Optimization of supercontinuum spectrum using genetic algorithms on service oriented grids,,2009.0
Optimization for maximum Raman frequency conversion in supercontinuum sources using genetic algorithms,Revista mexicana de fisica,2017.0
Antiferromagnetic Ising model in a triangular vortex lattice of quantum fluids of light,Science Advances,2024.0
Anomalous effects of radioactive decay rates and capacitance values measured inside a modified Faraday cage: Correlations with space weather,Europhysics Letters,2017.0
Cell viability and shock wave amplitudes in the endothelium of porcine cornea exposed to ultrashort laser pulses,Graefe's Archive for Clinical and Experimental Ophthalmology,2017.0
Photonic snake states in two dimensional frequency combs,Nature,2023.0
Many particle spectroscopy of atoms molecules clusters and surfaces: international conference MPS 2016,The European Physical Journal D,2017.0
Femtosecond pulse compression in a hollow core photonic bandgap fiber by tuning its cross section,Photonics and Nanostructures Fundamentals and Applications,2012.0
Ecofriendly Perovskites with Giant Self Defocusing Optical Response,Advanced Optical Materials,2023.0
Space based Femtosecond Laser Filamentation,,2015.0
Designing supercontinuum spectra using Grid technology,,2010.0
Propagation of intense femtosecond laser pulse in water and acoustic waves generation,Conferencia,2014.0
Modeling the tapering effects on the modal parameters of a hollow core photonic bandgap fiber,Conferencia,2011.0
Algorithms for Noise Reduction in Signals: Theory and practical examples based on statistical and convolutional analysis,IOP Publishing,2022.0
Dissipative light bullets in externally driven multimode Kerr cavity with parabolic 3D potential,Conferencia,2022.0
Dark solitons dispersive waves and their collision in an optical fiber,Conferencia,2018.0
PT symmetric bound states in the continuum,,2018.0
Cell viability and shock wave amplitudes in the endothelium of porcine cornea exposed to ultrashort laser pulses,Investigative Ophthalmology & Visual Science,2016.0
Acoustic wave generation by multifilamentation in water,Conferencia,2016.0
Soliplasmon excitations at metal/dielectric/Kerr structures,Frontiers in Optics,2009.0
Reconfigurable Topological Dissipative Light Bullets,Arxiv preprint arXiv:,2024.0
Hybrid patterns and solitonic frequency combs in non Hermitian Kerr Cavities,Physical Review Letters,2024.0
Hybrid frequency combs in non Hermitian Kerr Cavities.,Conferencia,2024.0
Dissipative light bullets and 3D breathers in a passive coherently driven multimode Kerr cavity,Conferencia,2023.0
Frequency Combs and Photonic Snakes,Conferencia,2023.0
Bright and dark solitons in pure quartic Kerr resonators,Conferencia,2023.0
High order resonances of solitons in a passive coherently driven cavity with a parabolic potential,,2023.0
Dissipative light bullet attractor in a passive coherently driven multimode Kerr cavity,Conferencia,2023.0
Spatiotemporal light bullets breathers and collapse in coherently driven passive nonlinear cavities with parabolic potentials,Conferencia,2023.0
Cumulative effects in high repetition rate filaments,Conferencia,2022.0
Ecofriendly Perovskites with Giant Self Defocusing Optical,,2021.0
Kapitza pendulum effect with overclocked Raman comb solitons in a microring resonator,Conferencia,2019.0
Dispersive wave emission from dark solitons and their collision in optical fibers,Conferencia,2018.0
Cavitation dynamics induced by laser superfilaments in water,Conferencia,2017.0
Supercontinuum generation with bright and dark solitons in optical fibers,Arxiv preprint arXiv:,2016.0
Guiding Discharges along Curved Paths,,2015.0
Acoustic sources in water designed and triggered by optical filamentation,Conferencia,2015.0
Imaging Energy Deposition of Femtosecond Pulses in Raman Active Materials,Conferencia,2015.0
Underdense channels generated in air by energetic femtosecond laser pulses,Conferencia,2015.0
Guiding Discharges Around Obstacles,Conferencia,2015.0
Bessel Vortex Filaments for Laser Material Processing,Conferencia,2015.0
Accelerating and locked Raman solitons in micro ring resonators: Role in supercontinuum generation,Conferencia,2015.0
Laser guided curved electric discharges,,2015.0
Bessel filamentation in glass,SPIE Photonics West,2015.0
Curved and self healing discharges guided by optical beams,Conferencia,2014.0
Interferometric analysis of plasmas induced by filamentation guided electric discharges in air,,2014.0
Filamentation with Bessel beams and Bessel vortices,No indexada,2014.0
Bessel beam propagation in transparent solids for micromachining applications: theory simulations and experiments,,2014.0
Imaging Ultrafast Light Matter Interaction with Inverse Raman Scattering,,2014.0
Study of the interaction between multiple filaments in air,Conferencia,2014.0
Nonlinear energy deposition in water from fs laser pulses: effect of the input chirp,Conferencia,2014.0
Maxwell's equations approach to soliton excitations of surface plasmonic resonances,Arxiv preprint arXiv:,2012.0
Optimisation of nonlinear photonic devices: design of optical fibre spectra and plasmonic systems,Universitat Politecnica de Valencia,2012.0
C. Milian DE Ceballos Herrera DV Skryabin and A. Ferrando Opt. Lett. 37 4221 (2012).,Opt. Lett.,2012.0
Novel properties of soliton plasmon interactions,,2011.0
Properties of 1D soliton plasmon interactions,Frontiers in Optics,2011.0
Stability of soliplasmon excitations at metal/dielectric interfaces,,2011.0
Modeling nonlinear waves in photonics plasmonics and cold atoms,Optica pura y aplicada. Revista en espanol de optica y fotonica,2011.0
Curved and self healing electric discharges,,
Bending Electric Discharges with Lasers,,
Filamentation of TW Ultra Short Laser Pulse in Water,,
Energy Deposition and Acoustic Wave Generation through Femtosecond Filamentation of a TW Laser Pulse,,
Soliplasmon resonances at metal dielectric interfaces,Conferencia,
