title,journal,year
Networking en la comunidad biblio-documental,PROFESIONAL DE LA INFORMACION,1950.0
Informatizacion de la informacion sanitaria. Un reto todavia pendiente en Espana,PROFESIONAL DE LA INFORMACION,1950.0
Open Data y Linked Open Data su influencia en el ambito de las bibliotecas y documentacion,PROFESIONAL DE LA INFORMACION,1950.0
Red espanola de trabajos cientificos. Estudio de viabilidad de la implantacion de una biblioteca digital y analisis de sus derechos de,,
Poster presentation journals policies of storage and reuse of raw research data and their impact in five scientific areas,,
XV Jornadas Bibliotecarias de Andalucia,,
Tipo de contribucion: poster,,
Gobierno abierto y acceso a la informacion: un estudio de caso sobre el impacto en la economia local,Bid Textos Universitaris de Biblioteconomia I Documentacio,
Beyond fake news. The anatomy of misinformation,,
Las revistas ante los datos de investigacion. Analisis de las soluciones actuales,,
ż Como escoge una revista una solucion para sus datos de investigacion? Indicadores a analizar,,
Los datos de alto valor y su reutilizacion en la ciencia,,
CovidData-19. Una experiencia de recogida y utilizacion de datos durante durante la crisis de la pandemia.,,
Observatory/Observatorio,,
Investigando sobre salud en la Comunitat Valenciana,,
Menu principal,,
Acceso abierto a la fotografia. La implantacion de Open Archives Initiative-Protocol for Metadata Harvesting,,
