title,journal,year,otros_investigadores
Linear chaos,"Universitext, Springer Verlag",2011.0,K Grosse-Erdmann;A Peris Manguillot
Hereditarily hypercyclic operators,Journal of Functional Analysis,1999.0,J Bes;A Peris
Application and optimization of the discrete wavelet transform for the detection of broken rotor bars in induction machines,Applied and Computational Harmonic Analysis,2006.0,J Antonino-Daviu;M Riera-Guasp;J Roger-Folch;F Martinez-Gimenez;...
A dynamic trading rule based on filtered flag pattern recognition for stock market price forecasting,Expert Systems with Applications,2017.0,R Arevalo;J Garcia;F Guijarro;A Peris
Hypercyclic operators on non-normable Frechet spaces,journal of functional analysis,1998.0,J Bonet;A Peris
Disjointness in hypercyclicity,Journal of mathematical analysis and applications,2007.0,J Bes;A Peris
Hypercyclic behaviour of operators in a hypercyclic C0-semigroup,Journal of functional analysis,2007.0,JA Conejero;V Muller;A Peris
Li–Yorke and distributionally chaotic operators,Journal of Mathematical Analysis and Applications,2011.0,T Bermudez;A Bonilla;F Martinez-Gimenez;A Peris
Distributional chaos for linear operators,Journal of Functional Analysis,2013.0,NC Bernardes Jr;A Bonilla;V Muller;A Peris
"Hypercyclic, topologically mixing and chaotic semigroups on Banach spaces",Studia Mathematica,2005.0,T Bermudez;A Bonilla;J Conejero;A Peris
Chaos for backward shift operators,International Journal of Bifurcation and Chaos,2002.0,F Martinez-Gimenez;A Peris
Multi-hypercyclic operators are hypercyclic,Mathematische Zeitschrift,2001.0,A Peris
Li–Yorke chaos in linear dynamics,Ergodic Theory and Dynamical Systems,2015.0,NC Bernardes;A Bonilla;V Muller;A Peris
Set-valued discrete chaos,"Chaos, Solitons & Fractals",2005.0,A Peris
On hypercyclicity and supercyclicity criteria,Bulletin of the Australian Mathematical Society,2004.0,T Bermudez;A Bonilla;A Peris
Recurrence properties of hypercyclic operators,Mathematische Annalen,2016.0,J Bes;Q Menet;A Peris;Y Puig
Chaos on hyperspaces,"Nonlinear Analysis: Theory, Methods & Applications",2009.0,JL Garcia Guirao;D Kwietniak;M Lampart;P Oprocha;A Peris
Distributional chaos for backward shifts,Journal of Mathematical Analysis and Applications,2009.0,F Martinez-Gimenez;P Oprocha;A Peris
Disjoint mixing operators,Journal of Functional Analysis,2012.0,J Bes;O Martin;A Peris;S Shkarin
A Banach space which admits no chaotic operator,Bulletin of the London Mathematical Society,2001.0,J Bonet;F Martinez-Gimenez;A Peris
Linear chaos on Frechet spaces,International Journal of Bifurcation and Chaos,2003.0,J Bonet;F Martinez-Gimenez;A Peris
Universal and chaotic multipliers on spaces of operators,Journal of mathematical analysis and applications,2004.0,J Bonet;F Martinez-Gimenez;A Peris
Disjoint hypercyclic linear fractional composition operators,Journal of mathematical analysis and applications,2011.0,J Bes;O Martin;A Peris
Hypercyclic translation C0-semigroups on complex sectors,Discrete and Continuous Dynamical Systems-Series A (DCDS-A),2009.0,JA Conejero;A Peris
Operators with common hypercyclic subspaces,Journal of Operator Theory,2005.0,R Aron;J Bes;F Leon;A Peris
Transitive and hypercyclic operators on locally convex spaces,Bulletin of the London Mathematical Society,2005.0,J Bonet;L Frerick;A Peris;J Wengenroth
Syndetically hypercyclic operators,Integral Equations and Operator Theory,2005.0,A Peris;L Saldivia
Distributional chaos for operators on Banach spaces,Journal of Mathematical Analysis and Applications,2018.0,NC Bernardes Jr;A Bonilla;A Peris;X Wu
Frequently dense orbits,Comptes Rendus Mathematique,2005.0,KG Grosse-Erdmann;A Peris
Linear transitivity criteria,Topology and its Applications,2005.0,JA Conejero;A Peris
Strong mixing measures for linear operators and frequent hypercyclicity,Journal of Mathematical Analysis and Applications,2013.0,M Murillo-Arcila;A Peris
Distributional chaos for operators with full scrambled sets,Mathematische Zeitschrift,2013.0,F Martinez-Gimenez;P Oprocha;A Peris
Uncountably generated algebras of everywhere surjective functions,Bulletin of the Belgian Mathematical Society-Simon Stevin,2010.0,RM Aron;JA Conejero;A Peris;JB Seoane-Sepulveda
Hypercyclic semigroups and somewhere dense orbits,Comptes rendus. Mathematique,2002.0,G Costakis;A Peris
DISTRIBUTIONAL CHAOS FOR STRONGLY CONTINUOUS SEMIGROUPS OF OPERATORS.,Communications on Pure & Applied Analysis,2013.0,AA Albanese;X Barrachina;EM Mangino;A Peris
Universality and chaos for tensor products of operators,Journal of Approximation Theory,2003.0,F Martınez-Gimenez;A Peris
Quasinormable spaces and the problem of topologies of Grothendieck,Annales Fennici Mathematici,1994.0,A Peris
Frequently recurrent operators,Journal of Functional Analysis,2022.0,A Bonilla;KG Grosse-Erdmann;A Lopez-Martinez;A Peris
Weakly mixing operators on topological vector spaces,"Revista de la Real Academia de Ciencias Exactas, Fisicas y Naturales",2010.0,KG Grosse-Erdmann;A Peris
Strong transitivity properties for operators,Journal of Differential Equations,2019.0,J Bes;Q Menet;A Peris;Y Puig
Powers of hypercyclic functions for some classical hypercyclic operators,Integral Equations and Operator Theory,2007.0,RM Aron;JA Conejero;A Peris;JB Seoane–Sepulveda
Mean Li-Yorke chaos in Banach spaces,Journal of Functional Analysis,2020.0,NC Bernardes Jr;A Bonilla;A Peris
On the injective tensor product of quasinormable spaces,Results in Mathematics,1991.0,J Bonet;A Peris
Some questions about subspace-hypercyclic operators,Journal of Mathematical Analysis and Applications,2013.0,RR Jimenez-Munguia;RA Martinez-Avendano;A Peris
Comparison of different wavelet families for broken bar detection in induction motors,,2015.0,JC Hernandez;J Antonino-Daviu;F Martinez-Gimenez;A Peris
Chaotic asymptotic behavior of the hyperbolic heat transfer equation solutions,International Journal of Bifurcation and Chaos,2010.0,JA Conejero;A Peris;M Trujillo
Distributionally chaotic translation semigroups,Journal of Difference Equations and Applications,2012.0,X Barrachina;A Peris
The specification property for backward shifts,Taylor & Francis Group,2011.0,S Bartoll;F Martinez-Gimenez;A Peris
"Transitivity, dense orbit and discontinuous functions",Bulletin of the Belgian Mathematical Society-Simon Stevin,1999.0,A Peris
Mixing properties for nonautonomous linear dynamics and invariant sets,Applied Mathematics Letters,2013.0,M Murillo-Arcila;A Peris
-supercyclic versus  -supercyclic operators,Archiv der Mathematik,2002.0,T Bermudez;A Bonilla;A Peris
"Frequent hypercyclicity, chaos, and unconditional Schauder decompositions",Israel Journal of Mathematics,2012.0,M De la Rosa;L Frerick;S Grivaux;A Peris
Chaotic polynomials on Banach spaces,Journal of mathematical analysis and applications,2003.0,A Peris
Hypercyclicity criteria and the Mittag-Leffler theorem,Bulletin de la Societe Royale des Sciences de Liege,2001.0,A Peris
Topological tensor products of a Frechet Schwartz space and a Banach space,Studia Math,1993.0,A Peris
Cesaro bounded operators in Banach spaces,Journal d'Analyse Mathematique,2020.0,T Bermudez;A Bonilla;V Muller;A Peris
Operators with the specification property,Journal of Mathematical Analysis and Applications,2016.0,S Bartoll;F Martinez-Gimenez;A Peris
Product recurrence for weighted backward shifts,Applied Mathematics & Information Sciences,2015.0,VJ Galan;F Martinez Jimenez;P Oprocha;A Peris Manguillot
Linear dynamics of semigroups generated by differential operators,Open Mathematics,2017.0,J Alberto Conejero;C Lizama;M Murillo-Arcila;A Peris
Tratamiento de senales digitales mediante wavelets y su uso con Matlab,Editorial Club Universitario,2013.0,FM Gimenez;AP Manguillot;FR Escriba
Chaotic behaviour of birth-and-death models with proliferation,Journal of Difference Equations and Applications,2012.0,J Aroza;A Peris
Sums and products of bad functions,Contemporary Mathematics,2007.0,RM Aron;JA Conejero;A Peris;JB Seoane-Sepulveda
Vector-valued holomorphic germs on Frechet-Schwartz spaces,Proceedings of the Royal Irish Academy. Section A: Mathematical and Physical ...,1994.0,KD Bierstedt;J Bonet;A Peris
Finite intersection property and dynamical compactness,Journal of Dynamics and Differential Equations,2018.0,W Huang;D Khilko;S Kolyada;A Peris;G Zhang
Set-valued chaos in linear dynamics,Integral Equations and Operator Theory,2017.0,NC Bernardes Jr;A Peris;F Rodenas
Strong mixing measures for -semigroups,"Revista de la Real Academia de Ciencias Exactas, Fisicas y Naturales. Serie ...",2015.0,M Murillo-Arcila;A Peris
Chaotic translation semigroups,Conference Publications,2007.0,JA Conejero;A Peris
A projective description of the Nachbin-ported topology,Journal of mathematical analysis and applications,1996.0,C Boyd;A Peris
Nonlocal operators are chaotic,Chaos: An Interdisciplinary Journal of Nonlinear Science,2020.0,C Lizama;M Murillo-Arcila;A Peris
Operadores y semigrupos de operadores en espacios de Frechet y espacios localmente convexos,"PhD thesis, Universidad Politecnica de Valencia",2004.0,JA Conejero;J Bonet;A Peris
Topologically ergodic operators,"Function Theory on Infinite Dimensional Spaces IX, Madrid",2005.0,A Peris
Some results on Frechet spaces with the density condition,Archiv der Mathematik,1992.0,A Peris
On shadowing and chain recurrence in linear dynamics,Advances in Mathematics,2024.0,NC Bernardes Jr;A Peris
Questions in linear recurrence: From the T⊕ T-problem to lineability,,2023.0,S Grivaux;A Lopez-Martinez;A Peris
Dynamics of shift operators on non-metrizable sequence spaces,Revista Matematica Iberoamericana,2021.0,J Bonet;T Kalmes;A Peris
Sets of periods for chaotic linear operators,"Revista de la Real Academia de Ciencias Exactas, Fisicas y Naturales. Serie ...",2021.0,JA Conejero;F Martinez-Gimenez;A Peris;F Rodenas
Weak stability of non-autonomous discrete dynamical systems,Topology and its Applications,2018.0,Y Lan;A Peris
Chaotic behaviour on invariant sets of linear operators,Arxiv preprint arXiv:,2012.0,M Murillo-Arcila;A Peris
Numerically hypercyclic operators,Integral Equations and Operator Theory,2012.0,SG Kim;A Peris;HG Song
Slow Growth for Universal Harmonic Functions,,2010.0,A Peris;F Rodenas
Erratum to:“Chaotic polynomials on Frechet spaces”,Proceedings of the American Mathematical Society,2001.0,A Peris
Maurey's extension theorem and Grothendieck's probleme des topologies,Journal of the London Mathematical Society,1998.0,A Defant;A Peris
Frechet Schwartz spaces and approximation properties,Mathematische Annalen,1994.0,A Peris
Chaotic asymptotic behaviour of the solutions of the Lighthill–Whitham–Richards equation,Nonlinear Dynamics,2016.0,JA Conejero;F Martinez-Gimenez;A Peris;F Rodenas
Chaotic polynomials on sequence and function spaces,International Journal of Bifurcation and Chaos,2010.0,F Martinez-Gimenez;A Peris
Existence of hypercyclic polynomials on complex Frechet spaces,Topology and its Applications,2009.0,F Martinez-Gimenez;A Peris
Chaotic polynomials on Frechet spaces,Proceedings of the American Mathematical Society,1999.0,A Peris
Localization of bounded sets in tensor products,Revista matematica de la Universidad Complutense de Madrid,1996.0,MJ Rivera Ortun;A Peris
Chaos on Fuzzy Dynamical Systems,Mathematics,2021.0,F Martinez-Gimenez;A Peris;F Rodenas
Ergodic and dynamical properties of m-isometries,Linear Algebra and its Applications,2019.0,T Bermudez;A Bonilla;V Muller;A Peris
"Cantor sets, Bernoulli shifts and linear dynamics",Descriptive Topology and Functional Analysis: In Honour of Jerzy Kakol’s ...,2014.0,S Bartoll;F Martinez-Gimenez;M Murillo-Arcila;A Peris
On the existence of polynomials with chaotic behaviour,Journal of Function Spaces,2013.0,NC Bernardes Jr;A Peris
Erratum to “Uniform convergence and chaotic behavior”[Nonlinear Anal. TMA 65 (4)(2006) 933–937],"Nonlinear Analysis: Theory, Methods & Applications",2008.0,RM Abu-Saris;F Martinez-Gimenez;A Peris
Coincidence of topologies on tensor products of Kothe echelon spaces,Stadia Math,1994.0,J Bonet;A Defant;A Peris;MS Ramanujan
A hypercyclicity criterion for non-metrizable topological vector spaces,Functiones et Approximatio Commentarii Mathematici,2018.0,A Peris
Chaos for linear fractional transformations of shifts,Topology and its Applications,2016.0,RR Jimenez-Munguia;VJ Galan;F Martinez-Gimenez;A Peris
Chaos for the dynamics of Toeplitz operators,Mathematics,2022.0,S Bartoll;RR Jimenez-Munguia;RA Martinez-Avendano;A Peris
The Specification Property for -Semigroups,arXiv preprint arXiv:,2016.0,S Bartoll;F Martinez-Gimenez;A Peris;F Rodenas
Numerically hypercyclic polynomials,Archiv der Mathematik,2012.0,SG Kim;A Peris;HG Song
Accurate Criteria for Broken Bar Detection in Induction Motors Based on the Wavelet (Packet) Transform,Mathematics,2024.0,JA Antonino-Daviu;F Martinez-Gimenez;A Peris;N Ramezanzadeh;...
The Specification Property for -Semigroups,Mediterranean Journal of Mathematics,2019.0,S Bartoll;F Martinez-Gimenez;A Peris;F Rodenas
Small ball properties for Frechet spaces,RACSAM,2003.0,L Frerick;A Peris
Transfer arguments for spaces of operators and tensor products,Note di Matematica,1997.0,A Defant;A Peris
Integracion multiple y vectorial,Coleccion Academica,2023.0,JA Bonet Solves;V Calvo Rosello;A Peris Manguillot;...
Rate of growth of distributionally chaotic functions,arXiv preprint arXiv:,2018.0,C Gilmore;F Martinez-Gimenez;A Peris
Mini-Workshop: Hypercyclicity and Linear Chaos,Oberwolfach reports,2007.0,T Bermudez;G Godefroy;KG Grosse-Erdmann;A Peris
Some Questions of Heinrich on Ultrapowers of Locally Convex Spaces,Mathematische Nachrichten,1993.0,A Galbis;A Peris
Questions in linear recurrence I: the  -recurrence problem,Analysis and Mathematical Physics,2025.0,S Grivaux;A Lopez-Martinez;A Peris
On disjoint dynamical properties and Lipschitz-free spaces,Results in Mathematics,2025.0,C Cobollo;A Peris
"Generalized hyperbolicity, stability and expansivity for operators on locally convex spaces",Journal of Functional Analysis,2025.0,NC Bernardes Jr;BM Caraballo;UB Darji;VV Favaro;A Peris
"Mini-Workshop: New Horizons in Linear Dynamics, Universality, and the Invariant Subspace Problem",Oberwolfach Reports,2024.0,S Grivaux;K Grosse-Erdmann;E Matheron;A Peris
Recurrence in collective dynamics: From the hyperspace to fuzzy dynamical systems,arXiv preprint arXiv:,2024.0,I Alvarez;A Lopez-Martinez;A Peris
Stock volatility as an anomalous diffusion process,AIMS Mathematics,2024.0,RV Arevalo;JA Conejero;O Garibo-i-Orts;A Peris
Chaotic finite difference operators,Chaos: An Interdisciplinary Journal of Nonlinear Science,2023.0,M Murillo-Arcila;A Peris;A Vargas
Orbit Tracing Properties on Hyperspaces and Fuzzy Dynamical Systems,Axioms,2022.0,S Bartoll;F Martinez-Gimenez;A Peris;F Rodenas
Questions in linear recurrence: From the -problem to lineability,arXiv preprint arXiv:,2022.0,S Grivaux;A Lopez-Martinez;A Peris
Chaos for the Dynamics of Toeplitz Operators,,2022.0,B Arnau;RR Jimenez-Munguia;RA Martinez-Avendano;...
Sets of periods for chaotic linear operators,"Revista de la Real Academia de Ciencias Exactas, Fisicas y Naturales. Serie ...",2021.0,JAC Casares;FM Gimenez;A Peris;FR Escriba
"Produccio matematica i impacte de les Illes Balears, Catalunya i la Comunitat Valenciana",SCM-Noticies,2021.0,O Baranova;A Peris Manguillot
Ergodic and dynamical properties of m-isometries,,2019.0,TDJ Bermudez De Leon;AL Bonilla Ramirez;V Muller;A Peris
The Specification Property for C0-Semigroups,,2019.0,B Arnau;F Martinez Jimenez;A Peris Manguillot;FDA Rodenas Escriba
Infinite Dimensional,,2018.0,R Aron;J Bonet;CG Collado;D Jornet;M Maestre;M Acosta;O Blasco;...
Operators with the specification property,,2016.0,B Arnau;F Martinez Jimenez;A Peris Manguillot
Investigacion interdisciplinar experimental de arte contemporaneo y matematicas,II CONGRESO INTERNACIONAL DE INVESTIGACION EN ARTE VISUALES,2015.0,EM Perez Garcia;A Peris Manguillot
Strong mixing measures for C0-semigroups,Springer,2015.0,A Peris
Preface special issue: Advances and applications in qualitative studies of dynamics,Discrete and Continuous Dynamical Systems,2014.0,P Oprocha;A Peris
Journal metrics,Abstract and Applied Analysis,2014.0,A Peris;M Maestre;YS Choi;A Domoshnitsky;R Shklyar;V Stolbov
Invariant sets and topological mixing prop-erties for nonautonomous linear dynamics,IX Iberoamerican Conference on Topology and its Applications,2014.0,A Peris
"Dynamics, operator theory, and infinite holomorphy",Abstract and Applied Analysis,2014.0,A Peris;M Maestre;M Martin;YS Choi
Strong mixing measures for linear operators and frequent hypercyclicity,Elsevier,2013.0,A Peris
Deterministic discrete dynamical systems: Advances in regular and chaotic behavior with applications,,2013.0,R Abu-Saris;F Allan;M Kulenovic;A Peris
The specification property for backward shifts,,2012.0,B Arnau;F Martinez Jimenez;A Peris Manguillot
Three-space-problems and small ball properties for Frechet spaces,Functiones et Approximatio Commentarii Mathematici,2011.0,A Peris
Operadores debil mezclantes en espacios vectoriales topologicos,"Revista de la Real Academia de Ciencias Exactas, Fisicas y Naturales. Serie ...",2010.0,KG Grosse-Erdmann;A Peris
Canvi de variables en integracio multiple,Universitat Politecnica de Valencia,2009.0,A Peris Manguillot
Camps conservatius,Universitat Politecnica de Valencia,2008.0,A Peris Manguillot
Integral de Linia,Universitat Politecnica de Valencia,2008.0,A Peris Manguillot
Quadriques,Universitat Politecnica de Valencia,2008.0,A Peris Manguillot
Integracio multiple i vectorial,Ed. Univ. Politec. Valencia,2006.0,JB Solves;VC Rosello;AP Manguillot;FR Escriba
Open problems session,INTERNATIONAL JOURNAL OF BIFURCATION AND CHAOS,2003.0,A Gasull;S Kolyada;L Snoha;C Mira;A Peris;P Raith;JA Rodriguez;...
Semigroupes hypercycliques et orbites quelque part denses,Comptes rendus-Mathematique,2002.0,G Costakis;A Peris
A note on tensor products of compact diagonal operators,Bulletin de la Societe Royale des Sciences de Liege,1997.0,A PERIS
VECTOR-VALUED HOLOMORPHIC GERMS ON,Proceedings of the Royal Irish Academy,1994.0,KD BIERSTEDT;J BONET;A PERIS
Pseudo-orbits in linear dynamics,,,A Peris
Anomalous diffusion vs. stock volatility through machine learning,,,JA Conejero;A Peris;R Vicente-Arevalo
Localization of Bounded Sets,,,A PERIS;MJ RIVERA
NUMERICAL METHODS MEET LINEAR CHAOS,,,S BARTOLL;F MARTINEZ-GIMENEZ;A PERIS;F RODENAS
Wild dynamics and periods for operators on Hilbert spaces,,,A Peris
RATE OF GROWTH OF DISTRIBUTIONALLY CHAOTIC FUNCTIONS,,,F CLIFFORD GILMORE;GIM ENEZ;A PERIS
On the interplay between non-linear and linear dynamics,,,A Peris
Distributional chaos for linear operators,,,A Peris
Locaiization ofBounded Sets in Tensor Products,,,A PERIS;MJ RIVERA
On the chaotic dynamics of fractional difference operators,Welcome to Santiago,,C Lizama;M Murillo-Arcila;A Peris
Linear dynamics: Somewhere dense orbits are everywhere dense!,,,A Peris
On Mixing Properties for Semigroups of Operators,,,JA Conejero;A Peris
A-hypercyclicity and recurrence in linear dynamics,Congreso Bienal de la Real Sociedad Matematica Espanola,,A Peris
Chaotic behavior of linear operators on invariant sets,,,M Murillo;A Peris
Irregular operators with increasing norms of iterates,,,V Muller;A Peris
